81,"Linubak nga Saging",9.00,9.00,17.00,33.00,"Linubak nga Saging is a traditional cuisine practiced and used to cook by the people not
only in the mountainous area in the municipality of Laua-an but at the same time by the locals who
are in the coastal area.

In the neighbouring coastal barangays like Guisijan, Lindero, Malamawan, Liya-liya and the
mountainous barangays like Latazon, Guiamon, and San Ramon are known to prepare Linubak nga
Saging. The idea of cooking this cuisine started even the time of their ancestors who remarkably part
and carried throughout.","The vast land of mountains, seas and the traditional practices of the people in the municipality
of Laua-an constitutes the richness of their culture. One of the cultures that defines the traditional way
of life by the locals is the cuisine. Traditionally, the locals are used to making a brunch that is served
in every home. Sometimes it was served as a welcome food offered to the visitors.

Linubak nga saging is one of the traditional foods served and prepared by the locals in
barangay Cadajug, Laua-an, Antique despites of its geographical location which is a coastal barangay
however the knowledge of the practice was inherited through and by their folks. This is one of the
traditional foods made purely by the locals. Though there is no written proof of how it started, the
locals are used to preparing this traditional cuisine as a part of their everyday life.

According to Lyn Ubaldo, during those times when life was not yet influenced by technology,
the locals used to cook this together with traditional instruments such as, "" lusong"" and ""hal-o"".
Lusong is a local term for a boat-like instrument made of wood and hal-o, a long piece of wooden
wood shaped like the hips of a woman. These were the instruments used to crush ""saging nga sab-a""
or it is sometimes called ""saging nga pungo"". Basically hal-o and lusong were made through the
wood came from Artocarpus Blancoi (Tipolo) and Java Plum (Duhat). These trees are traditionally
used by the locals because of their durability.","Saging nga Sab-a (a type of cooking banana)
Muscovado Sugar (for sweetness, adjusted to taste)","Here is the process on how to make ""linubak nga saging"" according to Mrs. Ubaldo.

1. Prepare the materials like cauldron and saging nga sab-a.

2. Wash the cauldron and saging nga sab-a.

3. Boil the banana or ""saging nga sab-a"" until cook.

4. Peel the banana or ""saging nga sab-a"".

5. Then, put it into the small hole of ""lusong"".

6. Pound by the use of ""hal-o"", until it is totally crushed.

7. Put a little muscuvado sugar depending on your taste and mix it
with a crushed banana by the use of ""hal-o"" to savor its taste.

8. Lastly, pound it repeatedly together with muscovado sugar and
""saging nga sab-a"" until it is mixed thoroughly

9. Serve","According to Mrs. Lyn Ubaldo, whose father is a farmer, her mother prepares this every time
her father brings home a ""saging nga sab-a"". She also noted that most of the wives of the farmers in
their community prepare this at home not just for commercial rather for consumption. The family of
Mrs. Lyn is just a family among the families who prepare this traditional food. Perhaps, almost all of
the families are preparing this cuisine.","The traditional knowledge which constitutes the processes of preparing ""linubak nga
saging"", was not documented or directly taught to the members of the family. However, during the
preparation, the members of the family are observing while it is prepared. This was observed and
practiced by the children whom it carried throughout and it became a life tradition.","The simplicity of life of the locals in Barangay Cadajug, Laua-an, Antique
and the neighbouring coastal barangays depict their culture, needs and wants. There was no written
evidences on how this traditional food started. However according to the locals, even before in the
early 1966 most of their families have already prepared and made this as one of the traditional
culinary made by their parents at home. According to them, most of the locals owned a ""saging nga
sab-a"" in their farm and even besides their respective homes, then, they come-up with the idea of
making it into more artistic. The advent of their own creativity formed a traditional culinary that
embedded their way of life that becomes a part of their everyday living.",,,,,,,,,"This traditional culinary practice is still visible in the community however there are only few
who are still doing it.","Before, ""Lusong"" and "" Hal-o"" were predominantly available in every home. However, today due to the influence of modern lives, these elements were not taken care of resulting that only few are practicing this traditional culinary. Its complexity of preparation is also one of the reasons that the locals lose their interest.","No safeguarding measures taken","The locals living in the coastal areas in the municipality of Laua-an were shaped by their
traditional culture. According to them, their life before are simple and poverty is one of the dominant
problem. Because of the situation they have experienced in life, then ""linubak nga saging"", is one of
the traditional food serves as bahaw (breakfast) in substitute to rice. The reasons why they made an
advent out from the saging nga sab-a (banana) because of its availability in the community and this
was served also as ""konsumo kag pang sapi-sapi"", a local term that connotes for consume. This was
the routine of life before because some of the locals owned a piece of land and some are not. Thus,
""saging nga sab-a"" serves as one of the option to take part in the lack of rice.","assets/kakanin_images/nilupak_na_saba.jpg"
82,"Ibus",2.00,9.00,17.00,34.00,"Barangay Codiong, Libertad, Antique and its neighboring barangays belonged in an
agricultural land wherein rice is the primary food for living. Due to the abundance of rice, the locals
create rice products such as lugaw, arroz caldo, puto, bibingka and ibus or rice cake.","The process of making ibus started a long time ago and it is still practiced up to the
present.","In doing such a recipe, one must prepare the following ingredients: malagkit or
glutinous rice, salt, sugar, and coconut milk.","In a wide bowl or container, combine the coconut
milk, sugar, and salt. Stir to dissolve the sugar and salt. Then, transfer the mixture in the
kawali or large iron pan until the mixtures get warm. Add the drained malagkit rice to the
mixtures and stir gently and continuously with the use of luwag or wooden ladle until it
absorbs. Then, remove the pan from heat and allow the mixture to cool. The challenge in
preparing ibus is not in the cooking process but in preparing the container. Lukay or coconut
leaves are used as the container. One must swirl the lukay over a mold to make individual
containers. The mixture of malagkit rice, coconut milk, sugar and salt are scooped to each
container. This needs to be locked properly by tying the end of the lukay to hold its form.
After all the mixtures are wrapped, tie it by five and arrange it in a pot and cover with enough
water. Boil it for four hours or until the rice is fully cooked.","Ibus making is being practiced by both males and females who has the knowledge,
and ability to perform the whole culinary process","The whole process of Ibus making is being taught by the elders to the younger
generations to preserve the said culinary culture by way of formal and non-formal education
through observation and one-on-one instruction.",,,,,,,"Ibus is used as kakanin, which are eaten as snacks or meryenda in the morning, afternoon, siesta or before dinner. It is a source of income by the manug-ibus in the Municipality of Libertad where they sold it in the public market. Thus, it is served on the table during occasions like Fiesta, All Saints and Souls Day, Christmas, Birthdays, New Year, and other social gatherings. ",,,"The culinary culture is still on-going.","None","The whole process of Ibus making is being taught by the elders to the younger generations to preserve the said culinary culture by way of formal and non-formal education through observation and one-on-one instruction.","Ibus is prepared for special occasions like Fiesta, All Saints and Souls Day, Christmas, Birthdays, and other social gatherings. According to the locals, it is best served during New Years Eve as its sticky texture signifies close family ties, strong bond, and connection between and among families. In addition, it is best to hang, or air dry the ibus than it is being placed in the refrigerator. The longer it is hanged, the sweeter it tastes; however, it is consumed only for three days.","assets/kakanin_images/suman_sa_ibus.jpg"
83,"Alupe",1.00,9.00,17.00,35.00,"Alupe is one of the favorite native delicacies of Patnonganons especially in Barangay Igbarawan.
Alupe is also available in the town market during market day.",,"Cassava (grated)
Brown Sugar
Shredded Young Coconut
Banana Leaves (for wrapping)","1. Peel the cassava, then wash it
2. grate the cassava
3. If the cassava is old, put it in a cheese cloth or any clean cloth and squeeze the excess water. If is new, skip the squeezing part
4. Mix the cassava with the brown sugar and shredded young coconut
5. Mix well until all ingredients are combined
6. Was the banana leaves, and wipe it after washing
7. Put a spoonful of cassava mix into the prepared banana leaves.
8. Steam it with water for maximum of 1 hour","Melly M. Berte is 62 years old, married with 5 children. She is making different native
delicacies like alupe, ibos, suman and many others.","Together with her siblings, she learns how to make Alupe through her mother Melagros
Roquero Macunan by observing her making it for their meryienda. Now, she has 2 daughters
Genevivie and Donna that could be her successor.",,,,"Several occassions serve this cuisine. A Pasalubong",,"Cassava is a calorie-rich vegetable that contains plenty of carbohydrates and
key vitamins and minerals.","It has become the source of income for some families and people of
the town",,,"Alupe is a prevalent delicacy not only in Patnongon but in the Antique province, and can be found in
the markets.","Available supply of cassava (seasonal, peak the months available - July-December, March-April)
Capital for buying the ingredients
Weather condition (materials might get wet during rainy season)
Health condition of the maker","Her family helping her prepare the delicacy
Promoting the delicacy to other local and abroad","Way back then, people say that cassava is poisonous and some people died because of it.","assets/kakanin_images/suman_cassava.jpg"
84,"Linubak nga Saging",9.00,9.00,17.00,35.00,,"Linubak nga Saging was an innovative and creative pounding process of making a sumptuous
delicacy out of green Sab-a or Pungo of the indigenous people of Patnongon using salt only.
When muscovado sugar was first introduced by the Spaniards during the Spanish regime, locals
added sugar to Linubak nga Saging instead of salt for another exciting taste. The locals had been
pounding ever since because of the availability of mortar and pestle.","Saging nga Sab-a (a type of cooking banana)
Muscovado Sugar (for sweetness, adjusted to taste)","1. Prepare the ingredients: cooked young green banana, sugar
2. Prepare mortar and pestle
3. Pound the banana with sugar and young coconut meat slowly until it becomes soft and sticky.",,,"Linubak nga Saging was an alternative food of the locals of Patnongon.","It's a type of enjoyment and pleasure to make indigenous menu which differs
from other menus.",,,,,,,,"Only those who are willing to pound and have experienced Paglubak have the eagerness to make
Linubak.","The threat is that only those who are passionate to explore have the opportunity to enjoy the food.
This indigenous food might be obsolete if it is not introduced and transmitted to the younger
generations and other people.","The practice is transmitted orally and observation in which it is passed down by their ancestors.","During the old days rice was so scarce and the people depended mainly on the organic food from the
forest and farms, so they had innovated some changes in preparing LINUBAK to sustain their life.
During those days food was so hard to find so people planted root crops, vegetables, fruits like
Bananas and others.","assets/kakanin_images/nilupak_na_saba.jpg"
85,"Sinakol",1.00,9.00,17.00,35.00,"Sinakol is cooked by locals in the municipality of Patnongon. It is also a staple native delicacy
Tound in other parts of Antique. In Iloilo, it is known as puto lanson or sometimes as aripahol. Various
dish variants have emerged from this simple dish as presented in other areas across Panay Island.","Sinakol is one of the traditional culinary foods not only in Patnongon but also in whole
Antique and throughout neighboring provinces.
According to some elders of Patnongon, Sinakol served as a substitute meal for rice
during war time.
Cooking Sinakol provides a source of income and employment to some Patnonganons.
During merienda or snack time and market day, many vendors in the food section of the
market sell Sinakol.","1 kilo Cassava
3 cups Water
50 grams Margarine
1/4 kilo Muscuvado sugar
","1. Peel the cassava and wash to make it clean. Grate the cassava and squeeze well
to dry.
2. Sift grated cassava in a strainer to separate the roots.
3. In a bowl, mix sifted grated cassava and mascovado sugar.
4. Meanwhile, boil water in the cauldron.
5. In an empty small clean can, 4 tbsp cassava mix.
6. When the water is boiling, the place can be filled with uncooked Sinakol on top.
Steam for 2 to 3 minutes.
7. Brush the cooked Sinakol with margarine then serve.","According to some vendors, they learned preparing and cooking Sinakol from their parent's as
their income to sustain their family.","Transmission of the said practice is through observation and narration.","Sinakol served as a substitute for rice during war time.","Sinakol is a Filipino delicacy served to visitors as snacks.",,,,,"Sinakol provides a source of income and employment to some Patnonganons vendors.",,,"Cooking Sinakol is always available in the Food section of the public market during market day. Until
today Sinakol is still served to visitors as snacks or meriendas during occasions.","The challenge of Sinakol is to lose its original context due to modernization and modification by adding
more ingredients to make the product adopt a modern concept.","Sinakol is a popular delicacy not only in patnongon but throughout Antique, and is passed from
generations to the other through observation and narrating its process. Moreover it is always available
in the market.","People in the community used to go out of their houses when a ""manuglibod"" of Sinakol went around
the streets.","assets/kakanin_images/puto_lanson.jpg"
86,"Tikoy",13.00,9.00,17.00,36.00,"In the area of Sibalom, there is one place where cooking of native delicacies such as tikoy is always observed- Esperanza 2nd. Esperanza II is situated at approximately 10.8078, 122.0172, in the island of  Panay. It is a neighboring barangay of Solong, Sibalom where the known solong bridge is located. From the municipality of Sibalom, approximately 3-5kms to Esperanza 2nd.","Tikoy is a type of rice cake made from glutinous rice flour and considered as a centerpiece
during Chinese New Year but in the case of our informant, this was made every Saturday or
any occasion as long as there are orders from their kasimario or people coming from other
towns that wanted to taste the specialty in the area of Esperanza 2nd, Sibalom, Antique.","2 kilos rice (pilit)
1/2 kilo sugar
2 pieces coconut
1/2 liter water","1.Prepare all the ingredients to be used. Mix all the ingredients. Grind all the mixtures. Place
the mixture in a large steamer. Cover the mixtures. Cook for 3 to 4 hours in a medium fire.
When it is done, let it cool. Slice . It can yield 50 pieces when served.","Salvacion F. Pamindalan, a 69 years old female and a native of the barangay was known to be
an expert in cooking this delicacy-Tikoy. Her cooking utensils such as the cover of the
steamer, steamer and the large skillet was inherited from her sister whom she acquired the
knowledge in cooking this native delicacy.","Cooking this native delicacy was acquired from Mila Amarillo, older sister of Salvacion
Pamindalan who is also a cook and loves to cook native delicacies in the barangay. When
Amarillo died, her younger sister Salvacion continued what her sister had started. It became
famous in town wherein most",,,,"A gathering of family and relatives because of the panguyang and daga,
ctreates a closer family ties. Sinapl can also be a way to introduce and teach the younger
generation the making of this. The children may be made aware that in other places in the
Philippines, this is one ordinary kakanin while for some a special and unique offering to
visitors of the place.","Besides puso (which is plain rice cooked inside a woven coconut
leaves), this is another mixture of cooked rice offered to the spirits during rituals done by",,"Once you are a family of maaram, you only are the ones who
make sinapal and other food preparations during rituals. The payment paid to the maaram is
one great help to their everyday living. This is one means of earning income.",,,"The practice continues as long as maarams are being consulted to do rituals they
believe are of big help to them. The making of sinapal can be learned and surely someone else
will learn this in the family of maarams.","The knowledge-bearers are in their golden years and the millennials are not so interested. If
there is no transfer of knowledge, this can be a threat.","As of this time, there are no known measures of safeguarding. There are still people in
the community and family that know this.","When Bangut Banwa hold its closing time rituals in the month of Lenten Season, one
thing they especially make is the sinapal, together with tuba the members of this organization
carefully put this inside the clay jars and on the second night after they immersed the sinapal,
with the tuba inside the jar, they sip the mixture using bagakay straw.

In rituals like panguyang and daga ka balay or sayaw sa kasal, this sinapla is eaten
after the rituals are done. Usually older people eat this because they are familiar with the smell
unlike the young generation who dislikes even just the smell.","assets/kakanin_images/tikoy.jpg"
87,"Linupak nga Saging",9.00,9.00,17.00,37.00,"Bananas are abundant in the area of Tibiao and so many products can be made out of the
plant including food delicacies like linupak. This delicacy is usually made every time there is an
abundance of banana fruits and is consumed as a breakfast item in the morning or as a snack in the
afternoon. This particular dish is also sold to neighboring barangays of Tibiao to augment financial
needs.","Before, linupak nga saging was made to augment the financially-challenged people
that could not afford to buy rice and other ingredients needed for meal preparation. It is
consumed in place of steamed rice and viand especially during the wet season, known to the
local people as tigkiriwi since little to no food is available in the community except bananas.
Bananas with full-grown fruits are harvested and prepared.","Saging na saba (ripe but not overly ripe, usually boiled or steamed before mashing)
Kalamay pula or muscovado sugar (for sweetening, depending on preference)","1. Pili-on ang saging nga puinungo nga indi tama ka luto
2. Tanokon ang pinungo nga saging hasta nga maraha lang ang ang sulod
3. Pagkatapos maraha ang saging, panitan samtang mainit pa
4. Gamit ang pinanitan kang saging nga pinungo, ang ya bayuhon sa sulod kang
lusong agud ya malimpyohan kag magdanlog kg malikawan ang pagdukut kang
saging samtang gina bayo
5. Amat-amaton ang pagbutang kang saging sa lusong samtang sige ang pagbayo
6. Butangan kang kalamay pula ukon muscobado na angay sa panabor
7. Bayuhon hasta nga mag pino ukon hasta mabuol ang gina pangita nga kapinuhon","Locals of the community","Transmitted through observation and participation in preparing the dish.",,,,"Socially, making linupak nga saging gathers people around usually among
family members, be it for a meal or a meryenda while having small talks about life and everything in
between.",,,"Economically, the dish sustains the economic needs of the people by
providing them with financial opportunities by selling these to the nearby barangays. At the same
time, it also provides persons selling bananas the opportunity to earn.",,,"It is still practiced by a few. It is sometimes consumed as a substitute for rice meals but more
commonly as a snack whenever there are saging nga pinungo available.","People nowadays see linupak as a snack and not as a meal anymore. So therefore, less and
less people are doing it out of necessity.","No safeguarding measures known.","To be supplied.","assets/kakanin_images/nilupak_na_saba.jpg"
