1,"Ilanchila",2.00,2.00,1.00,1.00,"Whole municipality of Lubuagan and the rest of the municipalities of the province of Kalinga","Ilanchila (coined from the native terms silan, which means ""like,"" and chila, which means ""tongue,"" as it looks ""like a tongue"") is the most popular traditional snack served not only in Lubuagan but also in other municipalities of the province of Kalinga. It is made out of the white chekot (sticky rice) called the wallayan (among the Lubuagan subtribe) or wallay (among the Uma subtribe) and drowned in coconut milk and lachok (coconut milk curds).

The ilanchila is served during the rites of:

Atod (a traditional rite that involves gift-giving for an ill child),
Sibit (a traditional rite conducted for a child who seems to miss or long for a particular relative),
Umila (visitation to a sick elder who underwent the rite of pusipus, a rite performed for a sick elder), and
Songot (a traditional rite for a recently buried dead).","Iyug (coconut)
Takung Leaf (taktakkong)
Wallay/Wallayan (white sticky rice)","Procedure A (Preparing the dough):
1. Pound the chekot thoroughly until it is powderized.
2. Place the powderized chekot in a container and slowly pour water on it to form a sticky 3. Portion the dough into fist-size balls. Align the balls on a clean takung leaf (commonly known the balls and form into tongue shape. Open the leaf to check if the desired tongue shape as taktakkong leaf), 4-5 balls can fit in 1 leaf. Wrap the balls with the leaf then press to flatten shaped doughs with the leaf then fold and seal properly. and the spaces of each dough from one another are achieved. Wrap again the tongue-
approximately an hour to cook every dough. 4. Put the wrapped doughs in a cauldron filled with water then boil over medium heat for
5. When cooked, take the wrapped doughs out from the cauldron and allow them to cool.
6. Once cool, unwrap the doughs, take them and place them on a serving plate then dip each dough into a sweetened coconut milk with lachok.
7. Serve and enjoy.

Procedure B (Preparing the coconut milk with coconut milk curds):
1. Choose a mature coconut to ensure sufficient coconut milk.
2. Grate the coconut meat or kernel, pour hot water on it then extract the coconut milk.
3. Bring the coconut milk to a simmer over medium heat until the coconut milk thickens and coconut milk curds form.
4. Add sugar and salt according to taste then stir well until the sugar dissolves.","Some iLubuagen women usually aged 40 years old and above","Through the demonstration of the women in the community which is observed by the young ones","Ilanchila is a snack that is part of the iLubuagen’s way of life since the past. It is greatly valued as the tastiest snack being utilized or served during the performance of almost all traditional rites in Lubuagan.","The ilanchila’s chewiness makes it tasty and the sweet and nutty flavor of the coconut milk and coconut milk curds make the snack irresistible.",,"The ilanchila is served as a snack during rites; thus, usually shared together with relatives, friends, and neighbors.","The ilanchila is being offered as a food provision for a recently buried dead.





",,,,,"Always cooked during atod, sibit, umila and songot and even served nowadays in other occasions",,"transmission, particularly through non-formal education, identification, documentation, research, promotion, enhancement","Once upon a time, there was a woman named Alus. She wanted to get a byatok (tattoo) so she decided to visit mambyabyatok (tattooist) Asselegen in the village of Sumadel of the municipality of Tinglayan. Before heading there, she prepared ilanchila placed in a langaya (a basket woven out of bamboo) and brought it with her.
On her way there, Ikan, a fish in a creek, asked Alus where she was going. Alus lowered her langaya, gave Ikan a piece of ilanchila and told the fish that she is going to have her skin tattooed by Asselegen.

As Alus journeyed to the village, she met Gayang, a hawk, who also asked her where she was heading. She again lowered her langaya, took a piece of ilanchila, gave it to Gayang and told the hawk that she is going to have her skin tattooed by Asselegen.
When Alus reached the place of Asselegen, Asselegen gladly welcomed her and was pleased to learn that Alus had even shared her ilanchila to the fish and the hawk. He meticulously did her tattoo and he was so careful in order to avoid possible tattoo wound complications.
Afterwards, Alus thanked the mambyabyatok and headed back home. On her way home, she him her tattoo, the hawk scratched it. Surprisingly, the hawk had made her tattoo more beautiful. again encountered Gayang who asked if he can a have a look at her tattoo. When Alus showed She thanked the hawk and proceeded towards her home. When she reached where Ikan was, the fish also asked if she can have a look at Alus' tattoo. Alus proudly showed the fish her tattoo. The fish then tapped the tattoo with its tail making it more magnificent. Alus thanked the
fish and returned to her home.

Tangkok grew envious and decided to get a tattoo as well. She cooked ilis-isla (steamed sticky When she arrived home, her friend Tangkok and her neighbors were amazed by her tattoo. But rice cake), sprinkled black roasted sesame seeds on the ilis-isla and hurriedly travelled to where
Asselegen is.

On her way there, she met Ikan who asked where she was headed. Tangkok was annoyed and did not answer the fish. Along the way, she also met Gayang who asked about what she was carrying on her head. Tangkok only frowned at the hawk.
When she reached Asselegen's house, the mambyabyatok was surprised to see that her ilis- isla was untouched. Asselegen was also puzzled why are there charcoals on the ilis-isla Nevertheless, Asselegen inked Tangkok right away.

On her way home, Tangkok again met Gayang who asked if he can take a look at her tattoo. Upon showing Gayang the tattoo, the hawk scratched it making the ink spread on her skin. Tangkok went furious and cursed the hawk while she walked away. Ikan also saw Tangkok and asked if she can have a look at her tattoo. Tangkok showed the fish her tattoo while complaining about how Gayang has ruined it. The fish angrily tapped her tail into Tangkok's tattoo and ruined
it even more.

When she reached her house, her friend Alus saw the tattoo and asked what happened. Tangkok cried bitterly and blamed the two animals while the neighbors laughed at her.
","assets/kakanin_images/inanchila.jpg"
2,"Inkiwar (Ilokano Biko)",4.00,3.00,2.00,2.00,"Inkiwar is a traditional process of cooking sweet delicacy made of Diket (Glutinous rice) that originated in the llocos Region. It can be found not only in the Philippines but also in other countries where there are Filipinos.","Inkiwar is a traditional way of cooking Kankanen (sticky rice delicacy) and one of the famous sweet delicacies of the Ilocanos. It is named after its process- Kiwar (to continuously stir). It is commonly served on special occasions like Fiesta, Christening, Birthday, Wedding and mostly during funerals, Panagkakararua (All Saints Day & All Souls Day) and Holiday Season. It is also a favorite Pasalubong (Souvenir) for the Balikbayans (OFWs).","• 1 Salop Diket (Dry measure: 3 liters of Glutinous rice); preferably Balatinaw (Black glutinous
rice).
• Gata (Coconut Milk); preferably 3 pieces Galimba Coconut
•1 piece Tagapulot (Sugarcane Jaggery)
•2 teaspoon of salt
•Coconut oil","1. Cooking Inkiwar starts with the preparation of 1 Salop Diket (Dry measure: 3 liters of Glutinous rice) preferably Balatinaw (Black glutinous rice). 
2. It is like cooking rice but it is done in a traditional way by using Dalikan (Traditional Ilocano Pottery used for cooking).
3. While waiting for the Diket to be cooked, combine the coconut milk (preferably from 3 pieces of Galimba Coconut) with 1-piece Tagapulot (Sugarcane Jaggery) and 2 teaspoons of salt in a Sinublan (traditional pan) and wait for it to be dissolved and boil on medium heat.
4. Keep stirring using Aklo (Wooden spatula) until half of the liquid has evaporated and thickened. Add in the cooked Diket and continue stirring to prevent it from burning and to make it stickier (The more you stir, the more it becomes sticky). Continue to cook and stir until it turns golden brown.
5. It is placed on a Bigao (woven circular tray) layered with Banana leaves brushed with coconut oil. Spread it, flatten it evenly and it is now ready to be served for up to 25 persons.","There are only Filipinos who know the process on how to cook this traditional sweet delicacy and they are mostly Ilocanos.","It is passed down in an Ilocano family for generations by simply performing and explaining the process of how to cook Inkiwar to their children. Since the children see their parents prepare this traditional sweet delicacy, they will be interested to join or help. It can also be passed through formal culinary education.","In 2012, the Municipality of Bauang, La Union attempted for the Guinness World Records ""Longest Inkiwar"" with a length of 305m and a width of 0.60m. It filled the streets around town plaza and later on served to locals and tourists.","It is a process called panagkiwar (continuous stirring) until it becomes golden-brown in color, gooey, sticky, and the distinct, nutty sweetness because of the coconut oil. It is served in a traditionally crafted Bigao layered with fresh Banana leaves. It is finalized by a Herringbone pattern that makes it eye-catching. It is one delicacy that's difficult to put down after you've had a bite.",,"It is commonly done by the Ilocanos during fiesta (specifically Fiesta ti Minatay/ Panagkakararua) and special occasions like Christening, Birthday, Wedding and mostly during funerals, Holiday Season and other special gatherings.",,,,,"Selling Inkiwar is one of the main sources of income of the Ilocanos.","Until now, Inkiwar making is still known because they still serve it especially in Ilocano tables. It is well preserved and passed down by ancestors.","• Lack of Income - It is a common challenge for small-time business owners. They can't buy bulk orders of ingredients and materials because their fund depends on their net income.
• Lack of Interest - The present generation is more interested in learning modern cuisine than learning the traditional ones. ","Inkiwar making is passed down by Ilocano ancestors and still being passed down in the Ilocano families in these Generations. It is also taught at schools and universities, specifically those who concentrate on Culinary Arts. There are many procedures on how to cook it and it is published not only in magazines but also on the web where the next generations can still read and appreciate this culture.",,"assets/kakanin_images/biko.jpg"
3,"Nilatikan",5.00,3.00,2.00,2.00,"Nilatikan is a process of cooking Latik or Nilatikan, a glutinous rice cake with latik topping is practiced in Bauang, La union. It can also be found in other parts of the Philippines and in other countries where there are Filipinos.","Nilatikan is a glutinous rice cake with caramelized toppings and sauce made of coconut milk and sinakob (panocha or mollases). It is a common merienda for Filipinos and is usually served during special occasions such as festivals, weddings, birthdays and baptismal.","• 1 Salop Diket (Dry measure: 3 liters of Glutinous rice)
• 3 cups of gata or coconut milk
•1 kilo of brown sugar/sinakob (panocha or mollases)
•Warm water or lamawan iti napudot nga danum
•Banana leaf","1. Cooking nilatikan starts with preparing the ingredients which are, 1 salop of diket (3 liters of glutinous rice), 3 cups of gata or coconut milk, 1 kilo of brown sugar/sinakob (panocha or mollases). 
2. After washing the diket, it will be set aside and soaked with warm water or lamawan iti napudot nga danum, this is to ensure that the glutinous rice will be cooked evenly.
3. The process will then continue in grating the coconut using a wooden stool with a metal grater. The process is called panaggadgad ti niyog. Old coconut, which has a dark brown colored shell is used to make gata or coconut. The reason is that the older the coconut, the thicker its flesh becomes and its milk has a thicker and creamier texture which is perfect in cooking nilatikan.
4. After grating the coconut add 3 cups of water onto the coconut shaving and then squeezed it by hand or with a cloth. It will be strained to ensure that there are no solid particles or coconut shaving added into the coconut milk. There are two types of coconut milk which they call umuna nga pespes which is usually the first press that has a thicker and creamier consistency and maykadwa nga pespes or the second press which has a thinner texture. Both are used and added to the mixture of nilatikan.
5. Next process is to add all the ingredients, remove the water from the glutinous rice using a strainer and then add the brown sugar (dissolve with 1 cup of water) and the coconut milk. 
6. Afterwards prepare the damilian or clay pot called pagbibingkaan, this is where the nilatikan will be cooked. 
7. For some Bauangeños, the most common way of cooking it is to separately cook the latik and kankanen, the latik will then be poured on top of the kankanen. The family of Belen has a unique way of cooking nilatikan, they combine all the ingredients and cook it all in a clay pot. 
8. The banana leaf plays an important part in the cooking process. Before pouring the mixture into the damilian, it will be covered with a banana leaf. Using a young banana leaf, it will be heated into the flame or what they call idalangdang ti apoy. This process softens the banana leaf making it easier to bend as they carefully lay it into the damilian. It is also important that the leaf does not have any hole, it will enable the latik to be slowly cooked and rise onto the rice cake.
9. Slowly pour the mixture to the damilian. 
10. Evenly spread the glutinous rice into the damilian this is done to ensure that it will be properly cooked. Another damilian, pre-heated with coal, is placed on top of the mixture. The heat from the burning coals must be balanced and just enough to cook the nilatikan gradually to the desired texture and until the latik will rise on the rice cake.","The family of Belen Supsup, who resides from Brgy. Paringao Norte/Este, is one of the few families who still practice the tradition of nilatikan. The members of the family are involved in cooking nilatikan to ensure it is passed down to the younger generation of the family.","Cooking nilatikan is a hand-me-down tradition, meaning it has been a part of Filipino family tradition and is being passed down from generation to generation. At present the family of Belen involves the participation of the younger family members in cooking nilatikan as a way for them to educate and pass down the family tradition.","Over the years, nilatikan has been a part of special events and festivals of the Filipinos. It has been a part of every family story and tradition. Embedded in most childhood memories.","Nilatikan is a glutinous rice cake with caramelized coconut milk and sinakob or brown sugar topping. Nilatikan gives you a gastronomical experience living you full but still wanting more. In the palette, the rice cake has a sticky but melts in the mouth texture. Slowly cooked to perfection with a distinct rich and smoky taste from the charcoal and banana leaf, mixed with the nutty and creamy flavor of the coconut milk and enhanced with the sweet flavor of the sinakob or brown sugar.",,"Nilatikan, just like other rice cake delicacies, are staple food for festivals and any occasions and because it involves a lot of process, most of the family members would collectively help in the cooking process. Each family member would be given their own task. For instance, harvesting and preparing the coconut milk are done mostly by the male family members and the rest of the cooking process is done by the female family members. Children would watch and sometimes help in the preparation of ingredients. It is also a form of bonding time for the family members.",,,,,"Different rice cake delicacies have been a part of Ilocano tradition. These are commonly served on different occasions and because of this it has also become an income generating sector of the food industry. Nilatikan has a distinct flavor which makes it a staple food or merienda for the Ilocanos and particularly for the Bauangeños. To the family of Belen, cooking and selling nilatikan has helped them improve their way of life. Selling nilatikan has
been their source of income.","Up to the present the traditional way of cooking nilatikan is still being practiced and served as part of special occasions. It is well preserved and is being passed down to younger generations.","Costing and seasonality:
Cooking nilatikan involves a lot of process thus not everyone wants to learn and participate in the tradition. Most of its ingredients are costly, not a lot of people can afford to buy or cook nilatikan. And because it is usually served on special occasions and festivals.","Nilatikan making is still practiced and is passed down as a family tradition to ensure its existence. At these modern times video blogs or documentaries which feature the procedure and process of cooking nilatikan are produced or uploaded to the digital platform as a way of reaching out to other people to educate them about the local delicacy. Some even add their own variation in cooking nilatikan.",,"assets/kakanin_images/bibingkang_malagkit.jpg"
4,"Binallay",2.00,3.00,2.00,2.00,"Binallay is a process of cooking malagkit that is practiced in Bauang, La are Filipinos. union. It can also be found in other parts of the Philippines and in other countries where there are Filipinos.","Binallay is a traditional kankanen of Ilocanos. Binallay is like most rice cakes. Glutinous rice flour is combined with water, mixed into a smooth batter, wrapped in a banana leaf, then steamed until cooked all the way through. The name binallay in Bauang had become a part of the history of Brgy. Ballay when it was taken after a miscommunication of the place to the native cake sold by vendors.

Binallay is commonly served during Lent and the Santurum or the Celebration of the Three Kings.","•4 cups glutinous rice(malagkit)
•1/2 cup water
•banana leaves, cleaned and cut into bigger sized (8x11 inch)
•banana or cotton strings
•coconut oil","1. In a bowl, place glutinous rice and water then soak for at least 3 hours. Drain.
2. Grind the soaked rice into flour then mix with water until well blended.
3. Singe the banana leaves into flames for a few seconds but do not burn. Let it cool then wipe with a clean cloth.
4. Grease banana leaves with coconut oil then scoop 3 tablespoons of rice mixture, fold the leaf to wrap the rice mixture.
5. Grab 2 pieces of wrapped rice mixture then tie with folded sides together using a string. 
6. In a steamer, pour enough water then steam the wrapped rice mixture for 1 1/2 hours or until done.
7. Unwrap the binallay and transfer it to the serving plate. Sometimes served with latik.

It has the same concept as any suman where rice is steamed, what sets this apart from the others is how it is presented. This delicacy is usually served as dessert or snack on any occasion.","The family of Milagring T. Ramirez, who resides in Brgy. Quinavite, Bauang, la Union is one of the few families who still practice the tradition of panagluto ti binallay. To ensure that it is passed down to the younger generation of the family, the family members are involved in cooking binallay.","Cooking kankanen has been a part of Filipino family tradition and is being passed down from generation to generation. At present, the family of Mrs. Ramirez involves the participation of the younger family members in cooking binallay as a way for them to educate and pass down the knowledge of cooking binallay.","Binallay is a type of kankanen, often served as meryenda. Kankanen has an integral part of the Filipino food culture. In Bauang, the history of how brgy. Ballay got its name originally from binallay. The ingredients are abundant in Bauang and with the knowledge of it, anyone can make a dessert for any occasion.","Binallay is a sweet munchies or sometimes desserts made of glutinous rice like the typical suman. These sweet sticky rice flour cakes wrapped in banana leaves give a nutty flavor to it while slowly steaming in a low heat until cooked. Sometimes topped with caramelized coconut reduction (latik) and a kape barako for an in-depth experience of the authentic life of bario.",,,"In Bauang, binallay tends to be cooked and prepared in their homes in commemoration of the occasions of Santurum or the celebration of the Three Kings.",,,,"Different rice cake delicacies have been a part of Ilocano tradition. A big part of it has become an income generating sector of the food industry. Binallay has a distinct flavor which makes it a staple food or merienda for the Ilocanos and particularly for the Bauangeños. To the family of Milagring T. Ramirez, cooking and selling nilatikan has helped them improve their way of life.","Panagluto ti Binallay is still being practiced and served as a part of special occasions.","Cooking binallay involves a lot of process thus not everyone wants to learn and participate in the tradition. Also, most of its ingredients are costly, not a lot of people can afford to buy or cook binallay.","Binallay making is still practiced and is passed down to ensure its existence. In these modern times video blogs or documentaries which feature the procedure and process of cooking binallay are produced or uploaded to the digital platform as a way of reaching out to cooking binallay. other people to educate them about the local delicacy. Some even add their own variation in cooking binallay.","According to Mrs. Milagring T. Ramirez, 62, has been making binallay to sell in her kankanen business in the market. She learned the process in childhood, by watching her Lola and mother. She has many goods such as suman, nilatikan, puto, and the binally that she herself makes. But she doesn't always sell binallay because it's hard to do as she gets older During the celebration of Sonturum or the three kings, binallay is a staple as what his grandparents used to do.

For some, binallay is also presented with a generous amount of the syrup called fore into the plate before the binallay is gently added, this prevents the very sticky rice cake from sticking to the plate. Then like sumon every bite is drenched into a sweet sauce, put it in your mouth and enjoy this simple treat.

During the Spanish regime, it was this barangay where most of the female residents used to make native cakes called ""BINALLAY"". When the ""SPANISH CONQUISTADORES"" were marching towards Baguio City, there were so many Filipina vendors selling ""BINALLAY"" along the road. The captain of the group ordered his men to stop. He approached one of the Filipina vendors and asked the name of the place where they were. The Filipina vendor misunderstood the captain, she thought he was asking for the name of the native cake she was selling, so she answered the captain ""BINALLAY"". ","assets/kakanin_images/binallay.jpg"
