49,"Suman",2.00,7.00,10.00,19.00,"Ang paggawa ng suman ay ginagawa sa ilang barangay sa Bayan ng Santa Cruz, gaya ng
Manlibunan, Aturan, Banahaw at sa ilan pang mga kalapit na lugar.","May kasabihan ang mga matatanda na ang kanin at kaning malagkit ang pinakamainam kainin dahil ito ay mula sa sipag at tiyaga ng mga magsasaka (Juankakanin. wordpress.com). Ang paggawa ng suman sa Santa Cruz ay tinatayang 170 taon nang tradisyon. Ito ay mula sa bigas na malagkit na niluluto sa katas ng niyog at kadalasan ginagawa tuwing may mga mahahalagang okasyon tulad ng pista, pasko at bagong taon. Ito ay ginagawa ding hanapbuhay ng ilang mga mamayan na tinagurian nang
""magsusuman.""","Ang mga sumusunod ay ang mga sangkap sa paggawa ng Suman. 

2 kilong bigas na malagkit
2 buong niyog (katumbas ng walong basong gata)
80 pirasong palaspas (o talbos ng dahon ng niyog)","Ang mga sumusunod naman ay ang mga paraan sa pagawa ng Suman

1. Hugasang mabuti ang bigas na malagkit hanggang magling malinaw ang tubig nito.
2. Ilagay ang malagkit sa kumukulong gata ng niyog.
3. Haluin ng bahagya na may katamtamang asin at hayaang maluto sa loob ng 5 minuto.
4. Kapag luto na ang malagkit, palamigin ito ng ilang oras.
5. Painitin ang dahon ng saging o palaspas ng niyog na pangbalot.
6. Balutin ang suman","Mga nagluluto ng suman. Isa dito si Aling Lucia Recana, 73 taong gulang, nakatira sa Barangay Manlibunan at halos 35 taon nang gumagawa ng suman.","Naituturo ng mga magulang sa mga anak kung paano magluto at magbalot ng suman.",,"Ang pagbalot ng suman ay isa na ring sining dahil kailangan gawin ito ng malinis, maayos at magandang tingnan. May mga nagbabalot na magaling gumawa na may kasama pang diseny upang lalong maging kaakit-akit.","Ang suman ay naging tradison nang ihain sa mga handaan at bahagi na ng pagsasalo-salo ng bawat pamilya.",,,"Madalas mas ginagamit ang dahon ng niyog sa pagbalot dahil mayroon itong
natural na bango at katangian na hindi madaling mapanis ang suman na binalot.","Ang paggawa ng suman ay naging hanapbuhay ng ilang mga mamamayan
ng Santa Cruz dahil marami ang bumibili nito bilang pagkain o pasalubong.
",,,"Patuloy ang paggawa ng suman at naipapasa sa mga anak kung paano ito lutuin at balutin.","Maaring mawala ang tradison kung wala nang mga kabataan na magpatuloy nito dahil karamihan ay nag-iiba na interest lutuin at binibili na lamang kung gustong kumain nito.",,"Naging tradisyon nang ihain ang suman tuwing may okasyon at tulong-tulong itong ginagawa ng mga matatanda noong araw. Nag-uumpukan sila upang balutin ang suman habang nagkukuwentuhan habang ang mga bata naman ay pinaglalaruan ang mga palaspas na hindi nagagamit sa pagbabalot.","assets/kakanin_images/suman.jpg"
50,"Bibingkang Pinahiran",5.00,7.00,10.00,19.00,"Ang ""Bibingkang Pinahiran"" ay kilalang produkto ng Santa Cruz. Marami ang mga gumagawa nito sa bayan subalit karaniwang mga pinanggagalingan ng mga ibinebenta sa mga palengke ay galing sa Barangay Lipa at Lusok. May mga gumagawa din nito galing sa mga barangay ng Banahaw, Bangcuangan, Manlibunan at iba pa.","Sinasabing ang ""Bibingka"" ay mula sa Pilipinas at Indonesia. Ayon sa The Oxford Companion to Food, ang kulturang pagluluto ng ""Bibingk"" ay mula sa Silangang Indonesia, pinaniniwalaang mahigit nang daang taon ang ganitong uri ng kulturang pagluluto.

Ang ""Bibingkang Pinahiran"" ay pagkain mula sa bigas at niluto sa hurno. Mahigit 50 taon na itong niluluto bahagi ng kultura sa bayan ng Santa Cruz at karaniwang kinakain tuwing agahan at inihahanda uwing araw ng Pasko, Bagong Taon at iba pang pagtitipon.","pagluluto ng bibingka, ang kailangang mga sangkap ay ang mga sumunod:

Isang (1) kilong pulang asukal
Isang (1) buong tuyong niyog
Dalawang (2) buong niyog
Isang (1) kilong giniling na bigas.","Direksyon:
Una, sasangagin at tutunawin ang pulang asukal sa kawali upang mas mamula-muln ang
Kulay. Kapag natunaw na, ilalagay ang gata ng niyos at hayaang kumulo. Paghalu.haluin ang mga sangkap sa loob ng 10 minuto. Sa kaldero, pakukuluin naman sa 6 na tasa ng tubig. Kapag kumukulo na, ilagay ang giniling na bigas at patuloy na haluin upang hindi maging buo at palamigin muna ito sa loob ng 5 minuto bago ilagay ng dahan-dahan sa hulmahan. Kailad nito pantay ang lagay sa bawat anggulo. Isusunod naman ang pagbubuhos ng pinaka-pahid nito na pinaka-unang niluto. Kapag naisagawa na ay ipapatong na sa ibabaw ng hulmahan ang lata na may gatong na bunot ing niyog. Ito ang magluluto sa bibingka. Paminsan-minsan na bubuksan upang malaman kung tuyo na ang pahid. Tinatayang nasa kalahating oras bago ito maluto. Ililipat naman ang gatong o baga sa ilalim upang ito naman ang o maluto. Pagkatapos ay palalamigin na ito para madali ang pagkuha sa hulmahan.","Si Angelina Profugo Prieto ay nagluluto ng bibingka bilang hanapbuhay. Umaabot sa 5-7 bilao ang kanyang naluluto sa isang isang araw. Yumao na ang kanyang asawang si Felix Prieto at naiwan siya at ang kanilang limang anak, tatlong babae at dalawang lalaki. Siya ay pang-apat sa limang anak ng mag-asawang Ignacio at Silvestra Profugo sa Barangay Lipa at nakapagtapos ng sekondarya sa Mataas na Paaralan ng Landy.","Natututunan ng mga anak mula sa mga magulang. Ayon kay Angelina Prieto, natutunan niya ito sa kanyang ina at naipasa naman sa pangalawang anak na lalaki na siya lamang, sa lima niyang anak, ang nagkainteres matutunan ito at gawin ding hanapbuhay.",,,"Bahagi na ng kultura ng mga taga Santa Cruz na maghain ng bibingka sa mga
pagtitipon tulad ng pista, pasko, bagong taon, binyag at iba pa.",,,,"Ginagawang pang hanapbuhay upang dagdag kita para sa pamilya.",,,"Patuloy pa rin itong ginagawa.","Kailangan ang pag-iingat sa pagluluto dahil mainit ito at maaring makapaso.","Patuloy na pagluluto nito.","Dalawampung taon nang nagluluto si Angelina Prieto ng bibingka mula noong dalaga pa lang siya at natutunan niya ito sa kanyang ina. Hindi madaling gawin dahil maraming kailangan ihanda at susundin na wastong timpla para maging masarap. Ginawa niya itong hanapbuhay nang mag-asawa siya upang makatulong sa gastusin ng kanyang pamilya.",
51,"Suman sa Lihiya",2.00,7.00,11.00,21.00,"Sa barangay Bulusan, isang rural na komunidad sa Calapan City, kung saan nakatira si Nanay Angelina. Nagluluto si Nanay Angelina ng suman (traditional rice cake). Ang isang pagbisita sa kanyang tirahan ay nagpapakita na siya ay nakatira sa isang bahay kasama ang ilan sa kanyang mga apo. Gamit ang tradisonal na recipe, paraan at kasangkapan, niluluto niya ang suman sa isang malaking kawali na inilagay sa kalan na gawa sa bakal. Si Nanay Angelina ay nagtatrabaho, hindi sa isang espesyal na itinalagang kusina para sa kanyang kaselanan kundi sa parehong sala kung saan ang kanyang mga apo ay nanonood ng mga palabas sa isang maliit na telebisyon. Sa kanyang living room-cum suman preparation area, makikita ang mga dahon ng niyog at dahon ng saging ng plantain: parehong ginagamit sa pagbabalot ng suman, kasama ang mga sako na naglalaman ng ibat ibang uri ng palay ng Malagkit (glutinous rice), Señorita, at Sinongsong rice varieties. Sa parehong lokasyon, may nakalatas na mga string mula sa napunit na putt at asul na mga sak ng bigas. Sa pagpasok pa sa bahay, makikita ang kusina kung saan nakaupo ang isang malaking kalan na pinaputok ng uling na gawa sa luwad, ilang mga palanggana na naglalaman ng mga pinatuyong balat ng niyog para sa pagniningas ng apoy para sa kalan, at isang makina para sa paghiwa ng karne ng niyog na binili niya mula sa kanyang kinita mula sa pagbebenta. Kanyang rice cakes. Sa isa pang bahagi ng kanyang malit na bahay ay may isa pang silid na nahahati sa dalawang resting area na hinating isang malaking cabinet na gawa sa kahoy. Sa labas ng bahay ay isang hardin kung saan ang bonsai at iba pang ornamental na halaman ay umunlad; na ayon sa kanya ay binebenta rin. Nakatayo ang kanyang bahay sa isang malaking lote na pag-aari ng kanyang mga kamag-anak sa panig ng kanayang ina at nagbibigay-daan sa sapat na espasyo para sa maraming halaman at hayop sa bukid tulad ng mga manok at pato pati na rin ang mga alagang hayop tulad ng mga aso at puusa na gumala at lumaki. Ang 15-20 minutong paglalakad mula sa kanyang tahanan ay magdadala sa isa sa isang taniman ng saging kung saan nakukuha niya ang mga dahon ng saging na ginagamit niya sa pagbabalot ng suman sa lihiya (rice cakes sa lihiya) na kanyang ibinebenta bilang pangunahing kita ng kanyang pamilya.","Si Nanay Angelina ay tubong bayan ng Bansud, Oriental Mindoro. Natutunan niya ang pagluluto at paghahanda ng suman mula sa kanyang ina na nagturo sa kanya noong siya ay labindalawang taong gulang pa lamang. Gayunpaman, katorse anyos pa lang siya nang magsama sa kanyang kasintahan para bumuo ng pamilya. Bago siya naging labing-walo ay mayroon na siyang dalawang anak na babae. Noong 1971, nagpasya silang mag-asawa na lumipat sa sitio Proper II, barangay Bulusan, Calapan City. Hindi tradisyon kundi kahirapan ang nag-udyok sa kanya na magluto at magtinda ng suman para mabuhay sila lalo na't lumalaki na ang sarili niyang pamilya na may apat na anak. Nagamit ni Nanay Angelina ang mga kakayahan na nakuha niya sa sarili niyang ina para masuportahan ang pangangailangan ng kanyang pamilya. Hanggang sa kasalukuyan ay patuloy siyang naghahanda ng tradisyunal na rice cake/suman dahil nasusustento pa rin nito ang pangangailangan ng kanyang pamilya.
Ang mga pangunahing sangkap na ginamit para sa kanyang suman sa lihiya (rice cake in lye) ay kinabibilangan ng mga sumusunod: bigas na malagkit (glutinous rice ng Senorita at Sinongsong varieties), lihiya (lye/caustic soda/lye water) gata ng niyog at brown sugar. Ang dahon ng saging ng Plantain ay ginagamit para sa pagbabalot ng mga indibidwal na rice cake.",,"Proseso ng pagluluto: Una, painitin kaagad ang mga dahon ng saging malapit sa apoy upang maging mas malambot at flexible ang mga ito. Ang mga dahon ay pinuputol sa mga piraso na may sukat na anim hanggang pitong pulgada ang haba at lapad; punasan ang bawat piraso ng malinis na tela upang alisin ang anumang dumidikit na uling o dumi. Pangalawa, hugasan ang 2.4 kilo ng bigas sa malinis na tubig. Hugasan ang bigas ng limang beses upang matiyak na ang rice cake ay magkakaroon
You sent
ng mas matabang buhay sa istante. Pangatlo, pagkatapos hugasan ain ay a1 aadagde ng 5 tbs.
ng lihya at kaunting asin. Haluing mabuti hanggang ang lahat ng kanin ay nahaluan ng lihiya at asin.
Pang apat, isa-isang balutin ang timpla sa pre cut na dahon ng saging (tulad ng pinapakita sa mga larawan) tali ang mga piraso gamit ang string upang makagawa ng mga pares na nakatali, Pagkatapos balutin ang lahat ng piraso, ihanay ang mga ito sa malaking yok/cauldron; at pagkatapos ay ibuhos ang tubig hanggang sa puntong ang lahat ng mga piraso ay lubusang nalubog sa tubig. Siguraduhin na ang pinakamataas na layer ng mga inilatag na piraso ay nakalubog upang maiwasang maging pula ang bigas at ang mga balo. kalima, ilagay ang yok/cauldron sa nasusunog na kalan at pakuluan ng hindi bababa sa labing-isang oras. Ang mga pambalot ng dahon ng saging ay magbabago ng kulay mula sa berde hanggang sa bahagyang itim na berde habang nagpapahiwatig na ang suman ay luto na.
Upang maghanda ng coco jam na matamis na sarsa para sa suman, ang brown sugar ay caramelized sa isa pang yok. Kapag ang asukal ay na-caramelized, purong gata ng niyog ang ibubuhos dito. Ang gata ng niyog ay ginawa sa pamamagitan ng pagpindot sa ginutay-gutay na mature na karne ng niyog. Ang patuloy na paghalo upang paghaluin ang caramelized na asukal at gata ng niyog ay magbubunga ng coco jam. Kapag lumamig ang coco jam, 2 tbsp, ng coco jam ang pumupuno sa isang plastic packet na sarado na may sealer. Ang isang pakete ng coco jam ay kasama ng isang pares ng suman. Minsan, mas pinipili ng mga customer na bumibili ng suman sa mga batch na ilagay ang kanilang coco jam sa loob ng mga garapon ng salamin.
Ibinahagi ni Nanay Angela na may panahon na tumataas ang benta ng suman, at ito ay sa mga buwan ng Nobyembre at Disyembre at gayundin sa mga gamu-gamo kung kailan mas maraming kasalan. Ang mga kasalan at karamihan sa mga pagdiriwang ng mga Pilipino ay nauugnay sa pagkonsumo ng suman. Bukod sa pagiging isang mahal na tradisyonal na pagkain sa Pilipinas, ang suman, na gawa sa malagkit na bigas, ay nagpapahiwatig ng pagkakaisa at lakas ng pagkakabuklod.
Ang suman sa lihiya ay pinakamahalaga sa panahon ng mga kasalan dahil ito ay nakabalot sa mga pares na nakatali. Sa kasalukuyan, bumagal ang produksyon ng suman, dahil sa pagbaba ng benta dahil sa pandemya, sabi ni Nanay Angelina.","Sa lahat ing magkakapatid sa kanyang pamilya sa Bansud, tanging si Nanay Angelina lamang ang patuloy na gumagawa at namimili ng suman.Mode of transmission (Describe how the knowleage and skills related to the element is passed on)
Bagama't tatlo sa kanyang apat na anak ang marunong magluto ng suman, ang kanyang mga apo lamang ang nagpapakita ng matinding interes sa paggawa ng suman at tinutulungan siya sa pagawa ngsuman sa inya (rice cake in lye) ngayon at ngayon ay nagsismula nang matutong magluro
ng suman sa kanilang sarili.",,,,,,,,,,"Ang tradison ng pagkonsumo ng suman sa mga espesyal na okasyon ay ginagawang isang kakit-akit na negosyo ang produksiyon ng suman at may potensyal na maging isang kumikitang negosyo kung mai-promote nang mabuti at ginawa gamit ang mga na-upgrade na pasiidad. Sa Calapan City lamang, maraming pangalan ang naging tanyag sa mass producing suman sa lihiya (rice cake in lye)","Isinalaysay ni Nanay Angelina na ang kahirapan ang nagtulak sa kanya upang lubos na mapaunlad ang kanyang kakayahan sa paggawa ng suman upang mapakain ang kanyang lumalaking pamilya. Ipinagpatuloy ng kanyang mga apo ang kanilang pag-aaral sa tulong ng kanilang kinikita sa pagtitinda ng suman.","Ang mga natural na kalamidad tulad ng mga bagyo ay nagbabanta sa produksyon ng suman dahil ang malakas na hangin ay sumisira sa mga halaman ng saging at ang kanilang mga dahon ay hindi magagamit para sa pagbabalot ng suman sa lihiya (rice cake sa lihiya).",,"Sa mga kasalan sa maraming probinsya sa Pilipinas, laging nasa hapag ang suman sa lihiya. Ito ay nagsasaad ng pagkakaisa at kasaganaan kasama ang pangunahing sangkap nito, ang malagkit o malagkit na bigas na karaniwan sa iba't ibang Señorita at Sinongsong. Ang pagbabalot ng suman na siyang dahon ng saging ng saging (ang pinakamatibay sa lahat ng dahon ng saging) at pinagtali sa magkapares upang ipahiwatig ang matibay na buklod ng mag-asawa.","assets/kakanin_images/suman_sa_lihiya.jpg"
52,"Kakaning Puto",1.00,7.00,11.00,22.00,"Sa Sitio Lumangbayan na sakop ng Barangay Teresita matatagpuan ang bahay ni
Prenny Temeña na siyang kilalang gumagawa ng kakaning puto sa bayan ng Mansalay.

Sa labas ng kanyang bahay mayroong espasyo na nakalaan para sa paggawa niya ng
kakanin at lagayan ng mga gamit sa pagluluto nito. Sa ibang mga barangay ng Mansalay ay
mayroon din gumagawa ng mga kakaning puto.","Ang kakaning puto ay kadalasang makikita sa hapag tuwing mayroong mga
selebrasyon. Madalas itong kasama o kapareha ng iba pang mga pagkaing pinoy
katulad ng dinuguan at pansit. Ang kakaning puto ay kadalasang gawa sa giniling na
bigas. ",,"Ang kakaning puto ay kadalasang gawa sa giniling na
bigas. Sa pagsisimula ng pamamaraan ng paggawa ng puto, ang bigas ay tinatahipan
at hinuhugasan nang mabuti. Ito ay ibinababad maghapon o kung minsan ay
umaabot ng magdamag upang mas maging malambot gilingin at maging maganda
ang tekstura pag ito ay niluto. Pag lumambot na ang bigas ito ay ginigiling sa
gilingang bato ng pinong pino. Galapong ang tawag sa giniling na bigas. Ito ay muling
ibababad magdamag at kinabukasan aalisin ang tubig sa ibabaw ng galapong, pag
naalis na ang tubig ay ihahalo na ang mga karagdagang sangkap tulad ng asukal at
pang pampaalsa. Mayroong maliit na lalagyan na siyang hulmahan ng galapong para
sa tamang sukat ng mga ito.
Ang mga hulmahan na may lamang galapong ay inilalagay sa lutuang may singawan
o steamer sa loob ng labing-lima hanggang dalawampung minuto. Pagkatapos ng
ilang minuto, luto na ang puto at maari na itong ilagay sa lalagyan para ibenta.","Si Aling Dina Trajico- Temeña ang kilalang dating gumagawa ng kakaning puto. Ang angking kaalaman niya sa paggawa at pagluluto nito ay ibinahagi niya sa kanyang mga kamag anak na ipangsasalin salin narin sa bawat henerasyon.","Ipinamana ang kaalaman sa pagluluto ng puto ni Ginang Finca Villaluna sa kanyang kamag-anak na si Dina Trajico- Temena na kung saan ang kaalaman naman niya tungkol dito ay itinuro niya sa kanyang anak na lalaki na Jesus Temefia na asawa ni Prenny Temefia na siyang kasalukuyang gamagawa ng kakaning puto sa bayan ng Mansalay. Tinuturuan din niya ang kaniyang mga anak sa paggawa ng kakaning puto. At hanggang sa kasalukuyan ang paggagawa ng puto ay patuloy nilang isinasagawa bilang kanilang hanapbuhay.","Makasaysayan: Ang pamilya ni Prenny Temena ay kilala na gumagawa ng kakaning puto sa buong bayan simula noong una hanggang sa kasalukuyan. Nananatiling tradisyunal ang kanilang paggawa ng puto kahit na mayroong mga makabagong pamamaraan na ng paggawa nito.","Bukod sa pagpapanatili ang orihinal na timpla nng kakaning puto, magandang klase ng bigas ang kanilang ginagamit upang maging galapong. Sa paglipas ng panahon, gumawa na rin sila ng iba pang mga hugis at hulma ng puto, maging ang kulay nito upang mas maging kaaya-aya at maganda sa paningin ng mga bumibili at tumatangkilik ng kanilang puto.",,,,,"Ang paggawa nila ng kakaning puto ang kanilang naging pangunahing pangkabuhayan na kanilang nagagamit upang matugunan ang kanilang mga pang araw-araw na gastusin. ",,,"Hanggang sa kasalukuyan, ang nananatili ang kanilang paggawa ng kakaning puto dahil na rin sa ito ay tinatangkilik ng mga nakakarami at isa sa pangunahing mga handa sa mga selebrasyon at mga pagtitipon. Ito ay patuloy na isinasagawa dahil naipapasa ito hanggang sa kasalukuyang henerasyon ng kanilang pamilya.","Ayon sa panayam sa isa sa mga anak ni Gng. Prenny Temeña, ang mga
nagiging problema lamang nila sa pagluluto ay sa tuwing nakakaligtaan nilang lagyan ng
tanda ang kanilang binabad na galapong ng bigas. Kung minsan ay naipagpapalit nila
ang binabad nilang galapong ng bigas sa binabad na galapong ng malagkit na nagiging
sanhi ng hindi magandang resulta.
Kung minsan naman ay hindi na nila kayang gumawa ng maramihan dahil sa
hindi na kaya ng katawan ang labis na pagod. Kung minsan hindi na nila kayang ihatid sa
kanilang mga suki ang mga puto. Kahit na madami na silang nagawang puto, madalas ay
hindi pa din ito sapat sa dami ng kanilang mga suki.","Ang kanilang ginagawang hakbang upang maipagpatuloy nila ang kanilang paggawa
ng kakaning puto ay ang paggawa nito ng masarap at may kalidad. Ipinamamana at itinuturo
nila ito sa kanilang mga anak upang hindi mawala at maipagpatuloy hanggang sa mga
susunod na henerasyon.","Ayon sa panayam kay Gng. Prenny Temeña, noong una ang pagtitinda ng kakanin puto ay sadyang napakahirap dahil na din sa anyo ng kanilang pamumuhay. Inilalako nila kanilang panindang puto sa bawat bahay upang ito ay maubos. Binabagtas nila o kabayanan sa pagtitinda ng puto habang sunung- sunong ang mga bilao na may man kakaning puto.

Dahil sa kanilang pagsusumikap sa paggawa ng puto nakapag pundar na sila ng tricycle upang magamit nila sa paglalako at paghahatid ng mga kakaning puto sa mga bahay bahay. Sa paglipas ng panahon, dahil na din sa makabagong teknolohiya mas napadali ang pagbebenta nila ng puto, kinukuhanan na lamang ito ng larawan at ipinopost sa social media kagaya ng facebook. At dahil dito maraming mga orders ang kanilang natatanggap. Ang pagtitinda nila ng puto ay kanilang naging kabuhayan at pinagkukunan ng pang araw-araw na gastusin.","assets/kakanin_images/putong_puti.jpg"
53,"Linutlut",13.00,7.00,12.00,23.00,"Ang linutlut ay niluluto malapit sa ilog na matatagpuan sa mga komunidad ng mga katutubong
Pelawan (Pala'wan) sa Brooke's Point. Halos lahat ng mga barangay dito sa bayan, maliban sa
Poblacion District 1 at 2, ay ginagawa ang pagluluto nito kapag may mga katutubong okasyon.","Ang pagluluto ng linutlut na kilala rin sa tawag na lutlut at mundog ay nakaugalian na ng mga
Pala'wan sa tuwing may mga katutubong okasyon bilang pasasalamat sa kanilang Empu (Diyos).
Niluluto nila ito partikular tuwing may piyesta, bulun (kasal), umanat (pasasalamat) pagkatapos
ng ani ng kaingin, at sagda na ginagawa kapag may gumagaling na may sakit.
Sa paniniwalang Pala'wan, kinakailangang matupad nila ang tradisyong ito taon-taon upang
walang masamang mangyari sa buong tribu o barangay at magpatuloy ang pagpapalang matamo
nila mula sa Empu.
Malapit sa ilog ang pagluluto ng linutlut na pinapangunahan ng panglima (pinuno), kasama
ang puas (pari) na magriritwal bago pagsaluhan ang niluto sa kelangbenwa (bahay-pulungan) kung
saan idinaraos ang kasiyahan. Ang puas din ang ang magtuturo kung saan ito naaangkop lulutuin
at karaniwang itinuturo niya ang pwesto na mapuno at hindi mahangin.","Ipahahanda ng penglima ang mga sangkap tulad ng gata at sapal ng niyog, asin at saka
malagkit na bigas. Kasama rin sa paghahanda ag mga kasangkapan sa pagluluto gaya ng bayuhan,
bilao, sako o kaya ay malaking palanggana, tabig (buslo) at mga pinutol na kawayan.","Mga Hakbang sa Pagluto:
1. Bayuhin ang malagkit na bigas para matanggal ang palay nito at saka tatahipan sa bilao.
2. Ilagay ang nabayong bigas na malagkit sa loob ng sako, at saka ibabad sa umaagos na tubig
sa loob ng 12 oras para lumambot at umalsa. Pwede ring ibabad ito sa palanggana o balde.
3. Pagkatapos ibabad ay kukunin na ito at kailangang hugasan upang maging malinis at
matanggal ang mga latak.
4. Ilagay ito sa tabig o sisidian na gawa sa buho upang patuluin.
5. Habang pinapatulo, magkudkod na ng niyog na magiging pansabaw sa linutlut.
6. Pagkatapos magkudkod, buhusan ng tubig ng ayon sa gustong dami at saka pipigain para
makuha ang gata at sasalain.
7. Ilagay ang gata sa kawayan hanggang sa kalahati nito at ilagay ang bigas na malagkit.
8. Kapag nailagay na ang lahat ng malagkit sa kawayan, ilalagay na ito sa marahang apoy
nang hindi masunog o mahilaw.
9. Habang nakasalang ito sa apoy, kailangan itong ikut-ikutin upang maluto nang maayos at
hindi masunog. Kung maraming niluluto ay tumatagal ng humigit kumulang apat na oras.
10. Para malaman kung luto na ang bigas, tinutusok ito ng patpat na kahoy. Kung malambot
na ang loob, ibig sabihin luto na ito at pwedeng nang hanguin, ritwalan, hain at kainin.","Ang panglima ang mangunguna sa mga magluluto ng linutlut, habang ang puas ang
magbabasbas pagkatapos ito maluto at bago kainin. Samantala, ang mga iba naman ang katuwang
sa paghahanda ng mga kainakailangan sa pagluluto tulad ng pagkorte ng kawayan at pagkudkod
ng niyog.
Sa Sitio Bayog, Barangay Aribungos, ang mga panglima na marunong magluto ng linutlut ay
sina G. Beto Calman, G. Saldino Melada, G. Renio Sindacan at G. Pusang Indayo. Sa Barangay Malis,
ito ay pinangungunahan ng pAnglima na si G. Tito Languan.","Ipinamamana ang paraan ng pagluluto ng linutlut sa mga nagnanais matuto nito. Natutunan
nila ito sa pamamagitan ng pagmamasid sa tuwing may nagluluto nitong pagkain.",,"Ang pagluluto ng linutlut ay ginagamitan ng sisidlan na kawayan na pare-pareho ang sukat.",,"Maraming mga tao ang pumupunta para makatikim at makakain nito, at dinadala ito sa mga
okasyon gaya ng Lutlut Festival pagkatapos ng ani at iba pang piyesta sa barangay upang gawing
meryenda at ipakain sa mga bisita. Sa pagluluto nito ay nagtutulungan ang mga kasapi ng katutubong
komunidad.","Tatawag muna sa Empu bilang bahagi ng orason na ginagawa ng puas ng mga Pala'wan
bago simulan ang kainan.",,"Sa ngayon, may mga gumagawa ng linutlut upang kanilang pagkakakitaan kung saan
kanila itong inilalako sa mga tao.","Ang nagluluto nito ay katutubong lider o panglima. Kapag inihahanda ito tuwing
okasyon gaya ng piyesta sa barangay, karaniwan ang matataas na pinuno ay kumakain din nito.",,"Marami pa ring gumagawa nito sa ngayon at karamihan ay ang mga naninirahan sa paanan ng
mga bundok sa Brooke's Point. Sa kapatagan ay unti-unti na itong nakakalimutan dahil sa mga
modernong pagkain.","Piling lugar na lamang ang gumagawa nito at unti-unti na ring nakakalimutan ang pagluto nito
dahil sa modernong panahon. Ilan din sa mga rason ay ang ang kahirapan sa buhay at pagbabawal sa
pagkakaingin kaya hindi na nakapagluluto nito. Kapag ipinagbabawal ang pagkakaingin ay apektado
ang pagprodyus nila ng malagkit at dahil mahirap lang sila ay wala silang pera pambili nito.","Sa pamamagitan ng panonood sa mga panglima ay natututo ang mga kasapi ng katutubong
Palawan sa pagluluto ng linutlut. Nagkakaroon din ng Linutlut Festival pagkatapos nilang mag-ani
upang mapreserba, maipakilala at mapagpatuloy pa ang tradisyon ng pagluluto nito.","Ang pagluluto ng linutlut ay nakaugalian na ng tribung Pala'wan gawin matapos ang masagana
pag-aani ng kanilang kainging palay, bilang pasasalamat sa kanilang Empu. Ginaganap ito sa mapunong
bahagi ng tabing ilog. Sa ilog naman ay kanilang ibababad ang malagkit na gagamitin para ito ay
lumambot agad at hindi mahilaw kapag niluto. Kung unti lang ang lulutuin, sa palanggana nila ibababad
ang malagkit na bigas. Lulutuin ito kasama ng gata na nilagay sa kawayan at dinarang sa marahang
apoy sa loob ng ilang oras.
Kapag handa na ang mga linutlut ay dadalhin na ang mga ito sa kelangbenwa o malaking
bahay-pulungan para maorasyunan bago pagsalu-saluhan sa idinadaos na okasyon. Sinasabing mas
napapasaya nito ang kanilang mga pagdiriwang kung saan sila ay umiinom din ng tinapey o
nakalalasing na inuming gawa rin sa bigas. Kinakailangang matupad nila ito taon-taon upang walang
masamang mangyari sa buong tribu o barangay, ayon sa kanilang paniniwala. Sa ngayon, may mga
gumagawa ng linutlut upang kanilang pagkakakitaan kung saan kanila itong inilalako sa mga tao.","assets/kakanin_images/linutlut.jpg"
